Student Number,Question 1 Answer,Question 2 Answer,Question 3 Answer,Question 4 Answer,Question 5 Answer
3439853985,"The Singleton design pattern restricts the instantiation of a class to one ""single"" instance and provides a global point of access to that instance. This pattern is used when exactly one object is needed to coordinate actions across the system. For instance, a Singleton can be used for a configuration manager that reads configuration settings from a file and provides these settings throughout the application. This solves the problem of ensuring that there is only one instance of the configuration manager, thereby preventing conflicting updates or redundant reads from the configuration file. The typical implementation involves making the class constructor private, defining a private static variable to hold the single instance, and providing a public static method that returns this instance. This method initializes the instance if it doesn’t already exist. For example, in a web application, a Singleton pattern can be used for a database connection pool manager to ensure all parts of the application share the same connection pool, improving resource utilization and management.","The imperative computational model involves writing code that describes the steps the computer must take to achieve a goal. In contrast, the declarative model focuses on describing the desired outcome without specifying how to achieve it. Examples of imperative languages include Java and C, which require detailed instructions and control flow. Declarative languages like SQL and HTML specify what the end result should be. Advantages of imperative programming include precise control over performance and execution, while declarative programming can simplify code and reduce errors by focusing on the result rather than the process.","Arrays and linked lists are two fundamental data structures with different implementations and use cases. An array is a collection of elements stored in contiguous memory locations, which allows for constant time O(1) access to elements via their indices. This makes arrays highly efficient for random access operations. However, arrays have a fixed size, and inserting or deleting elements requires shifting other elements, leading to linear time complexity O(n) for these operations. Arrays are preferable in scenarios where fast access to elements is critical, such as in a lookup table or when the size of the dataset is known in advance.

Linked lists, on the other hand, consist of nodes where each node contains data and a reference to the next node. This allows for dynamic memory allocation and efficient insertions and deletions with constant time O(1) complexity when you have a reference to the node being modified. However, accessing elements in a linked list requires traversing the nodes sequentially, resulting in linear time complexity O(n). Linked lists are",Debugging is finding and fixing errors in code. It's important to use debugging tools because they help. One common technique is using print statements to see where the code goes wrong.,Unit testing involves testing individual components of the software. Integration testing checks how different modules interact. System testing tests the entire application to ensure it meets requirements. Automated testing speeds up the process using tools like JUnit.
5439753497,"The Singleton design pattern restricts the instantiation of a class to a single object. It solves the issue of needing a single instance of a class to control access to resources. Typically, it’s implemented by making the constructor private and providing a static method that returns the single instance. This pattern is useful in scenarios like managing a connection to a database, where only one connection should be open at a time.",Imperative tells the computer how to do something step by step. Declarative describes what you want to achieve. Examples are Python for imperative and HTML for declarative. Imperative is more flexible.,"Arrays store elements in contiguous memory locations, allowing fast access with O(1) time complexity. Linked lists consist of nodes where each node points to the next, leading to O(n) access time. Insertions and deletions are O(n) for arrays but O(1) for linked lists when modifying the head.","Debugging is a crucial aspect of software development that involves identifying, diagnosing, and rectifying bugs or errors in a program. The use of debugging tools and techniques is essential as they streamline the process, making it more effective and less time-consuming. A common and effective debugging technique is the use of print statements. This technique involves inserting print statements at various points in the code to track the execution flow and the state of variables. By examining the output of these print statements, developers can gain insights into the program's behavior and identify where it diverges from expected behavior. For instance, if a loop is producing incorrect results, print statements can show the values of the loop variables at each iteration, helping to isolate the error and understand the underlying issue. This method provides a straightforward way to trace and debug complex logic errors, ultimately leading to more reliable and robust software.",Unit testing tests the smallest parts of the code. Integration testing tests how those parts work together. System testing tests the whole application. Automated testing tools like Selenium help by running tests automatically.
7569093434,"The Singleton pattern ensures a class has a single instance and provides a global access point to it. This is useful for classes that manage resources or configurations. To implement it, you make the constructor private and create a static method that returns the instance. For example, a logging class could use this pattern to ensure all messages are written to the same log file.","Imperative programming is about how to do things, and declarative is about what to do. C is imperative, and SQL is declarative. Imperative is good for performance; declarative is simpler.","Arrays and linked lists store elements differently. Arrays are contiguous in memory, while linked lists use pointers. Arrays are faster for accessing elements, but linked lists are more efficient for insertions and deletions.","Debugging involves fixing bugs in software. Using tools helps make it easier. For example, print statements can show where problems are in the code.","Unit testing, integration testing, and system testing are different levels of software testing. Unit testing checks individual components, such as functions or methods, to ensure they work correctly. Integration testing evaluates the interaction between different modules or components. System testing assesses the entire application to ensure it meets the specified requirements. Automated testing plays a crucial role in speeding up the testing process and ensuring consistency. Tools like JUnit are used for automated unit testing, allowing developers to write and run tests automatically."
4387539487,"The Singleton design pattern ensures that a class has only one instance and provides a global access point to that instance. This pattern is used to control access to shared resources and to avoid the overhead of creating multiple instances. The Singleton is typically implemented by making the class constructor private and providing a static method that returns the single instance of the class. This static method usually checks if the instance already exists and creates it if not. An example scenario would be a logging class that needs to write log messages to a single log file. Using a Singleton ensures all parts of the application use the same logger instance, maintaining consistency and preventing issues with concurrent file access.","Imperative programming involves commands for the computer to follow, such as loops and conditionals, found in languages like Python and C++. Declarative programming involves specifying what you want without describing how to get it, seen in languages like SQL and HTML. Imperative programming allows for fine-grained control and optimization, but it can be verbose and error-prone. Declarative programming simplifies code and maintenance but may limit control over performance details.","An array is a fixed-size list of elements, and a linked list is a dynamic list where each element points to the next. Arrays have fast access, but linked lists are better for adding and removing items.",Debugging is the process of finding and fixing bugs in software. Debugging tools are important because they help identify errors quickly. A common technique is using print statements to track the flow of the program and see where it breaks.,"Unit testing, integration testing, and system testing serve different purposes in software testing. Unit testing focuses on individual components to ensure they function as expected. Integration testing examines the interaction between different modules to detect interface issues. System testing evaluates the complete system to verify it meets the specified requirements. Automated testing is essential in software development as it enhances efficiency and accuracy. JUnit is an example of a testing framework used for automated unit testing, enabling developers to write tests that can be run automatically to catch errors early in the development process."
3409750397,The Singleton design pattern makes sure only one instance of a class exists. It solves the problem of having multiple instances when only one is needed. A database connection can be an example.,"Imperative programming specifies the steps to achieve a result, while declarative programming specifies what the result should be. Examples include Java for imperative and SQL for declarative. Imperative is more detailed but can be complex; declarative is simpler but less flexible.","Arrays and linked lists are two primary data structures used to store collections of elements, each with distinct advantages and disadvantages. Arrays allocate memory in a contiguous block, allowing for O(1) access time to elements by their indices. This makes arrays ideal for scenarios where fast random access to elements is required, such as in read-heavy applications or when the size of the dataset is known in advance. However, the fixed size of arrays can be a limitation, and inserting or deleting elements requires shifting other elements, leading to O(n) time complexity for these operations.

In contrast, linked lists consist of nodes where each node contains data and a reference to the next node. This allows for dynamic memory allocation, making linked lists suitable for scenarios where the size of the collection changes frequently. Insertions and deletions can be performed in O(1) time complexity when you have a reference to the node to be modified. However, accessing elements in a linked list requires traversing the nodes sequentially, resulting in O(n) time complexity.

For example, arrays are preferable when you need fast random access to elements, such as in a static lookup table or a fixed-size collection. Linked lists are advantageous in scenarios where you need efficient insertions and deletions, such as in implementing a dynamic stack or queue, or when the collection size is not known in advance.","Debugging is a vital process in software development, involving the detection, analysis, and resolution of bugs or errors within a program. The importance of using debugging tools and techniques cannot be overstated as they significantly enhance the efficiency and accuracy of the debugging process. One widely used debugging technique is the use of print statements. By placing print statements at strategic points in the code, developers can monitor the values of variables and the control flow of the program. This helps in pinpointing the exact location and cause of a bug. For example, if a function is not returning the expected result, print statements can reveal the intermediate values and identify where the logic deviates from the intended path, thus facilitating a quicker and more precise fix.","Unit testing, integration testing, and system testing are key stages in the software testing lifecycle. Unit testing targets individual components, ensuring each part works correctly in isolation. Integration testing focuses on the interaction between different modules, checking for interface and communication issues. System testing evaluates the entire application to confirm it meets the overall requirements and functions as intended. Automated testing is vital in modern software development, providing speed, repeatability, and consistency. Tools like JUnit facilitate automated unit testing, allowing for early detection of bugs and reducing manual testing efforts."
5604980986,"The Singleton pattern ensures that a class has only one instance and provides a global access point to that instance. This pattern solves the problem of having multiple instances when only one is needed, such as when managing shared resources. It’s implemented by making the class constructor private and creating a static method to access the instance. An example would be a logger class that ensures all logs are written to the same file.","Imperative programming specifies the exact steps needed to achieve a result, using constructs like loops, conditionals, and variables to manage the state of the program. Examples include languages such as C, Java, and Python. Declarative programming, in contrast, focuses on describing the desired outcome without specifying how to achieve it, relying on the language or framework to determine the best way to achieve that outcome. SQL for database queries and HTML for web page structure are examples of declarative languages. The advantage of imperative programming is its explicit control over the execution process, which can lead to optimized performance. However, it can be complex and harder to maintain. Declarative programming reduces complexity and increases readability, making code easier to maintain, but it may sacrifice some control over performance and execution details.","An array is a data structure that stores elements in contiguous memory, allowing for O(1) access time. However, insertions and deletions can be O(n) due to the need to shift elements. Linked lists, in contrast, consist of nodes where each node points to the next, resulting in O(n) access time. Insertions and deletions can be done in O(1) time if done at the head or with a reference to the node.

Arrays are useful in scenarios where you need quick access to elements by index, such as in a static lookup table. Linked lists are better when the size of the data structure is dynamic, and you need to frequently insert or delete elements, such as in an undo feature in applications.","Debugging means finding and correcting errors in a program. Tools like debuggers are crucial because they save time. One technique is using print statements to monitor variable values and program flow, which helps locate bugs.","Unit testing, integration testing, and system testing are three critical levels of testing in software development. Unit testing involves testing individual units or components of the software, such as functions or methods, to ensure they operate correctly. Integration testing examines the interaction between integrated modules to detect interface defects and communication issues. System testing evaluates the entire system's compliance with the specified requirements, ensuring the software works as a whole.

Automated testing is essential in software development because it enhances efficiency, accuracy, and coverage. Automated tests can be run frequently and consistently, catching bugs early in the development process and reducing the time spent on manual testing. One example of a testing framework for automated testing is JUnit, a widely used framework for writing and running automated unit tests in Java. JUnit allows developers to write test cases, execute them automatically, and review the results, thereby improving the overall quality of the software."
2347527853,"The Singleton pattern is a design pattern that restricts a class to a single instance and provides a global point of access to that instance. This pattern is particularly useful for managing shared resources, such as a connection pool or a configuration manager. To implement a Singleton, the class constructor is made private, and a static method is used to return the single instance. This prevents other classes from creating multiple instances. For example, a configuration manager class could use the Singleton pattern to ensure all parts of an application use the same configuration settings.","Imperative programming is a model where the programmer writes instructions that describe how to achieve a goal, manipulating the program state through statements and control structures like loops and conditionals. Examples of imperative languages include Java, C++, and Python. Declarative programming, on the other hand, involves writing expressions that declare what the desired result is, without specifying the steps to achieve it. SQL and HTML are examples of declarative languages. Imperative programming offers greater control over the execution flow and system resources, making it suitable for performance-critical applications. However, it can lead to complex and hard-to-maintain code. Declarative programming simplifies code by focusing on the desired outcome, improving readability and maintainability but can abstract away control, potentially reducing efficiency.","Arrays and linked lists are both data structures for storing elements. An array stores elements in contiguous memory locations, allowing O(1) access time. However, insertion and deletion operations can be costly (O(n)) due to the need to shift elements. Linked lists consist of nodes, each containing data and a pointer to the next node, resulting in O(n) access time. However, insertions and deletions can be done in O(1) if you have a reference to the node to be modified.

Arrays are preferable when you need fast random access to elements, such as in lookup tables. Linked lists are useful when you need frequent insertions and deletions, like in a queue implementation.","Debugging is the process of identifying and fixing bugs in software development. Debugging tools and techniques are important because they streamline the process and make it more efficient. A common debugging technique is using print statements to trace the execution of the program. By inserting print statements at various points in the code, developers can monitor the values of variables and understand the program's flow, making it easier to identify where things go wrong.","Unit testing, integration testing, and system testing are integral parts of the software testing process. Unit testing focuses on individual components, ensuring that each function or method performs correctly. Integration testing evaluates the interactions between combined modules, identifying issues that may arise from the integration. System testing assesses the entire application to ensure it meets all specified requirements and functions correctly in a production-like environment.

Automated testing plays a crucial role in modern software development, providing several benefits such as increased speed, repeatability, and reliability. Automated tests can be executed frequently to catch defects early, which helps maintain high-quality code and reduces the overall development time. JUnit is an example of a testing framework used for automated unit testing in Java applications. JUnit supports the creation of repeatable test cases and provides a straightforward way to run tests and report the results, significantly aiding in maintaining robust and error-free code."
5490845098,"The Singleton pattern ensures a class has only one instance. It’s useful for global state management. For example, it can be used for a configuration manager.","Imperative programming involves writing instructions that change the program's state, such as in C. Declarative programming involves stating the desired outcome, like in HTML. Imperative is better for performance, and declarative is easier to write.","Arrays have fixed sizes and store elements in contiguous memory, making access time O(1). Linked lists are dynamic and consist of nodes pointing to each other, leading to O(n) access time. Insertions and deletions in arrays are O(n) due to shifting elements, but are O(1) in linked lists if done at the beginning.","Debugging involves locating and resolving bugs in software. The importance of using debugging tools lies in their ability to simplify the process and reduce time spent on finding errors. For example, using print statements can help track the flow of a program and the state of variables, making it easier to pinpoint where the bug occurs. This technique is helpful because it provides a straightforward way to see what's happening in the code at different stages.","Unit testing, integration testing, and system testing are essential stages in the software testing process. Unit testing involves testing individual components or units of code, typically functions or methods, to ensure they work correctly. Integration testing examines the interactions between integrated modules to detect issues arising from their integration. System testing evaluates the entire system to ensure it meets the specified requirements and works as intended.

The role of automated testing in software development is paramount as it enhances testing efficiency, accuracy, and coverage. Automated tests can be run frequently and consistently, which helps in early bug detection and reduces manual testing efforts. One popular testing framework for automated testing is JUnit, which is used for writing and executing automated unit tests in Java. JUnit allows developers to create test cases, run them automatically, and analyze the results, thereby improving the overall quality and reliability of the software."
